{
  "version": 1,
  "id": "work-xr.geometry-gap",
  "route": "/work/xr",
  "route_role": "product-family",
  "kind": "geometry-gap",
  "status": "open",
  "source_handoff": "CLAW/control-plane/runtime/handoffs/C4-20260404T044816Z-04.json",
  "cycle_id": "C4-20260404T044816Z",
  "phase_id": "C4 / First generic product proof",
  "lane": "systems-qa",
  "hypothesis": "Fresh falsification on the current shared work-lane CSS will show whether /work/xr still violates layout, geometry-law, breakpoint, or flagship-invariant acceptance after the latest upstream slice.",
  "summary": "Rejected `/work/xr` after fresh layout, geometry-law, responsive, quality, and contrast falsification reruns.",
  "severity_counts": {
    "critical": 14,
    "major": 0,
    "minor": 0,
    "note": 0
  },
  "top_drift_surfaces": [
    "work.lane.hero.authority",
    "work.lane.nonclaims",
    "work.lane.metric.row",
    "work.lane.hero.meta",
    "work.lane.hero.identity",
    "work.lane.proof.assertions",
    "work.lane.hero.title",
    "work.lane.repo.shape",
    "work.lane.evidence.routes",
    "work.lane.proof.terminal",
    "work.lane.related.lanes"
  ],
  "flagship_invariants_intact": true,
  "responsive_integrity": {
    "horizontal_overflow": false,
    "notes": []
  },
  "quality_findings_summary": "`npm run audit:quality`: 0 critical, 0 major, 0 minor.",
  "recommendation": "Do not promote C4 from this checkpoint. Hand the route back for shared work-lane layout repair, then rerun layout, geometry-law, responsive, and contrast falsification from the repaired baseline.",
  "next_hypothesis": "Repair the shared work-lane hero and early proof row placement so XR no longer collapses to `x=8` / `width=1008` at the 1024px reference viewport, then re-baseline contrast before re-auditing C4.",
  "rollback_target": "1710391ffa9e4c2adfac272ebbf7dd61b45b4484",
  "evidence_files": [
    "CLAW/control-plane/runtime/logs/C4-20260404T044816Z-04.xr-gap-verdict.json",
    "deterministic-design-system/maps/diff/home.diff.json",
    "deterministic-design-system/maps/diff/imc.diff.json",
    "deterministic-design-system/maps/diff/work-ft.diff.json",
    "deterministic-design-system/maps/diff/work-xr.diff.json",
    "deterministic-design-system/maps/live/home.live.json",
    "deterministic-design-system/maps/live/imc.live.json",
    "deterministic-design-system/maps/live/work-ft.live.json",
    "deterministic-design-system/maps/live/work-xr.live.json",
    "deterministic-design-system/reports/C4-20260404T044816Z-04.xr-falsification.rejected.md",
    "deterministic-design-system/reports/contrast/contrast.verification.json",
    "deterministic-design-system/reports/contrast/contrast.verification.md",
    "deterministic-design-system/reports/geometry-laws/home.geometry-law.json",
    "deterministic-design-system/reports/geometry-laws/home.geometry-law.md",
    "deterministic-design-system/reports/geometry-laws/imc.geometry-law.json",
    "deterministic-design-system/reports/geometry-laws/imc.geometry-law.md",
    "deterministic-design-system/reports/geometry-laws/work-ft.geometry-law.json",
    "deterministic-design-system/reports/geometry-laws/work-ft.geometry-law.md",
    "deterministic-design-system/reports/geometry-laws/work-xr.geometry-law.json",
    "deterministic-design-system/reports/quality/quality.verification.json"
  ],
  "learning_captured": [
    "The prior `work-xr.geometry-gap` replay blocker is cleared; the gap is now backed by fresh measured geometry-law failure.",
    "A fresh contrast rerun can no longer be assumed green from the runtime summary; the current checkpoint produced 72 major contrast failures across the audited routes.",
    "Exported GGD gap work-xr.breakpoint-gap."
  ],
  "commands_run": [
    "pwd && git status --short --branch && git rev-parse HEAD && rg --files deterministic-design-system/reports deterministic-design-system/maps CLAW 'site/src/lib/layout/specs.ts' 'site/src/scripts/layout-diff.ts' 'site/src/scripts/responsive-audit.ts' | sed -n '1,40p'",
    "sed -n '1,180p' '/Users/zer0palab/.codex/skills/ggd-debug/SKILL.md'",
    "sed -n '1,180p' '/Users/zer0palab/.codex/skills/ggd-derive-equation/SKILL.md'",
    "sed -n '1,180p' '/Users/zer0palab/.codex/skills/ggd-dimensional-analysis/SKILL.md'",
    "sed -n '1,180p' '/Users/zer0palab/.codex/skills/ggd-limiting-cases/SKILL.md'",
    "sed -n '1,160p' '/Users/zer0palab/Get-Geometry-Done/ggd/shared/domain-adaptation.md'",
    "sed -n '1,180p' '/Users/zer0palab/Get-Geometry-Done/src/gpd/commands/debug.md'",
    "find deterministic-design-system/reports deterministic-design-system/maps CLAW -maxdepth 3 -type f | sed -n '1,120p'",
    "git show --stat --name-only --format=fuller c21f2aa4b4675b6de692800d44e3ad1daebc15b4",
    "git show --stat --name-only --format=fuller e0e8a98a9036e0892225c280f751779b0fa5ad16",
    "sed -n '1,220p' 'site/src/scripts/layout-diff.ts'",
    "sed -n '1,220p' 'site/src/scripts/responsive-audit.ts'",
    "sed -n '1,220p' 'site/src/lib/layout/specs.ts'",
    "grep -n 'audit:' 'site/package.json'",
    "sed -n '1,240p' 'site/src/scripts/geometry-law-audit.ts'",
    "sed -n '1,240p' 'site/src/scripts/quality-audit.ts'",
    "git merge-base --is-ancestor c21f2aa4b4675b6de692800d44e3ad1daebc15b4 HEAD; echo $?",
    "git merge-base --is-ancestor e0e8a98a9036e0892225c280f751779b0fa5ad16 HEAD; echo $?",
    "git log --oneline --decorate -5",
    "curl -I --max-time 5 http://127.0.0.1:3006",
    "npm run audit:quality",
    "npm run audit:layout",
    "npm run audit:geometry-law",
    "npm run audit:responsive",
    "python3 /Users/zer0palab/Get-Geometry-Done/scripts/ggd_equation_engine.py eval --expr 'col_width(1024, 2, 20)'",
    "sed -n '1,220p' 'deterministic-design-system/reports/work-xr.verification.md'",
    "sed -n '1,260p' 'deterministic-design-system/reports/geometry-laws/work-xr.geometry-law.md'",
    "sed -n '1,260p' 'deterministic-design-system/reports/responsive/responsive.verification.md'",
    "sed -n '1,240p' 'deterministic-design-system/reports/quality/quality.verification.md'",
    "curl -s http://127.0.0.1:3006/imc | grep -o 'data-spec=\"[^\"]*\"' | grep 'imc\\.' | sed -n '1,20p'",
    "curl -s http://127.0.0.1:3006/imc | grep -o 'data-spec=\"work\\.lane\\.[^\"]*\"' | sed -n '1,20p'",
    "npm run audit:contrast",
    "sed -n '1,240p' 'deterministic-design-system/reports/C4-20260404T011103Z-04.xr-falsification.rejected.md'",
    "sed -n '1,220p' 'deterministic-design-system/reports/contrast/contrast.verification.md'",
    "node -e \"const fs=require('fs');const d=JSON.parse(fs.readFileSync('deterministic-design-system/reports/geometry-laws/work-xr.geometry-law.json','utf8'));console.log(JSON.stringify({critical:d.findings.filter(f=>f.severity==='critical').length,major:d.findings.filter(f=>f.severity==='major').length,minor:d.findings.filter(f=>f.severity==='minor').length,top:d.findings.slice(0,5)},null,2));\"",
    "node -e \"const fs=require('fs');const d=JSON.parse(fs.readFileSync('deterministic-design-system/maps/diff/work-xr.diff.json','utf8'));const counts=d.diffs.reduce((a,x)=>(a[x.severity]=(a[x.severity]||0)+1,a),{});console.log(JSON.stringify({counts,top:d.diffs.sort((l,r)=>r.distance-l.distance).slice(0,5)},null,2));\"",
    "git status --short",
    "git diff --name-only",
    "git ls-files --others --exclude-standard",
    "git check-ignore -v 'CLAW/control-plane/runtime/logs/C4-20260404T044816Z-04.xr-gap-verdict.json' || true\nls 'CLAW/control-plane/runtime/logs/C4-20260404T044816Z-04.xr-gap-verdict.json'",
    "git add deterministic-design-system/maps/diff/*.json deterministic-design-system/maps/live/*.json deterministic-design-system/reports/C4-20260404T044816Z-04.xr-falsification.rejected.md deterministic-design-system/reports/contrast/contrast.verification.json deterministic-design-system/reports/contrast/contrast.verification.md deterministic-design-system/reports/geometry-laws/*.json deterministic-design-system/reports/geometry-laws/*.md deterministic-design-system/reports/quality/quality.verification.json && git add -f CLAW/control-plane/runtime/logs/C4-20260404T044816Z-04.xr-gap-verdict.json && git commit -m \"systems-qa: reject xr after fresh falsification\"",
    "git rev-parse HEAD",
    "git show --stat --oneline --no-patch HEAD",
    "git diff-tree --no-commit-id --name-only -r HEAD"
  ],
  "known_risks": [
    "The fresh contrast rerun indicates a broader shared-surface regression or contrast-harness mismatch beyond `/work/xr`; contrast cannot be claimed clean until reconciled.",
    "The responsive audit script refreshes shared artifacts for all audited routes, so future XR-only reruns will continue to mutate shared report/map evidence."
  ]
}
